{
  "$schema": "http://json-schema.org/draft-07/schema#",
  "$id": "https://raw.githubusercontent.com/ddutchie/cairn-community/main/schema.json",
  "title": "Cairn Community Connector",
  "description": "One connectors/<id>/connector.json — an installable MCP server or HTTP service. manifest.json is COMPILED from these by scripts/build-manifest.mjs; never hand-edit the manifest.",
  "type": "object",
  "required": ["kind", "author", "version", "category", "tags", "blurb", "definition"],
  "additionalProperties": false,
  "properties": {
    "kind": { "type": "string", "enum": ["mcp", "service"] },
    "author": { "type": "string", "description": "GitHub handle/org maintaining this entry." },
    "version": { "type": "string", "pattern": "^\\d+\\.\\d+\\.\\d+$", "description": "SemVer of THIS entry; bump to push an update to installed users." },
    "category": {
      "type": "string",
      "description": "The single category chip this connector groups under in Browse Community.",
      "enum": [
        "Project management",
        "Dev & Code",
        "Docs & Knowledge",
        "CRM & Support",
        "Search & Web",
        "Finance",
        "Design",
        "Automation",
        "Utilities"
      ]
    },
    "tags": { "type": "array", "items": { "type": "string" }, "description": "Freeform keywords for search only (not shown as chips)." },
    "blurb": { "type": "string", "maxLength": 200, "description": "One-line description for the browse card." },
    "brandColor": { "type": "string", "pattern": "^#(?:[0-9a-fA-F]{3}|[0-9a-fA-F]{6})$" },
    "homepage": { "type": "string", "format": "uri", "pattern": "^https://" },
    "icon": {
      "type": "object",
      "description": "Connector logo. Use exactly ONE of: slug (a simpleicons.org slug — fetched + sanitized by CI), svg (inline SVG string), or file (a .svg next to connector.json). Omit for the app's generic fallback.",
      "additionalProperties": false,
      "properties": {
        "slug": { "type": "string", "description": "simpleicons.org slug, e.g. \"jira\" (CC0)." },
        "svg": { "type": "string", "description": "Inline SVG markup (allowlist-sanitized at build)." },
        "file": { "type": "string", "description": "Relative .svg filename beside connector.json." }
      }
    },
    "definition": {
      "oneOf": [{ "$ref": "#/definitions/McpDefinition" }, { "$ref": "#/definitions/ServiceDefinition" }]
    }
  },
  "definitions": {
    "McpDefinition": {
      "type": "object",
      "required": ["name", "transport", "baseUrl", "enabled"],
      "additionalProperties": false,
      "properties": {
        "name": { "type": "string" },
        "description": { "type": "string" },
        "transport": { "type": "string", "enum": ["sse", "http"] },
        "baseUrl": { "type": "string", "format": "uri", "pattern": "^https://" },
        "headers": { "type": "object", "additionalProperties": { "type": "string" } },
        "authMode": { "type": "string", "enum": ["none", "oauth"] },
        "oauthScope": { "type": "string" },
        "disabledTools": { "type": "array", "items": { "type": "string" } },
        "enabled": { "type": "boolean" }
      }
    },
    "ServiceDefinition": {
      "type": "object",
      "required": ["name", "enabled"],
      "additionalProperties": false,
      "description": "An HTTP service. Either a legacy single-op (apiUrl + method + toolDefinition) OR a multi-op service (baseUrl + operations[]). Multi-op is preferred: one connector can expose several tools that share a base URL + headers/auth.",
      "properties": {
        "name": { "type": "string" },
        "description": { "type": "string" },
        "apiUrl": { "type": "string", "format": "uri", "pattern": "^https://", "description": "Legacy single-op endpoint. Use baseUrl + operations for multi-op." },
        "method": { "type": "string", "enum": ["GET", "POST", "PUT", "DELETE"] },
        "headers": { "type": "object", "additionalProperties": { "type": "string" }, "description": "Shared across all operations. Use <API_KEY> as a placeholder to inject the stored key." },
        "toolDefinition": { "type": "string", "description": "Legacy single-op stringified OpenAI tool JSON." },
        "baseUrl": { "type": "string", "format": "uri", "pattern": "^https://", "description": "Base URL for multi-op services; each operation's path is appended." },
        "operations": {
          "type": "array",
          "description": "Multi-op definition. Each operation becomes its own namespaced tool (svc__<id>__<opName>).",
          "items": {
            "type": "object",
            "required": ["name", "method", "toolDefinition"],
            "additionalProperties": false,
            "properties": {
              "name": { "type": "string", "description": "Un-namespaced tool name, unique within the service." },
              "description": { "type": "string" },
              "method": { "type": "string", "enum": ["GET", "POST", "PUT", "DELETE"] },
              "path": { "type": "string", "description": "Appended to baseUrl. {placeholder} segments are filled from arguments, e.g. /repos/{owner}/{repo}/issues/{number}." },
              "toolDefinition": { "type": "string", "description": "Stringified OpenAI tool JSON for this operation." },
              "paramLocations": {
                "type": "object",
                "additionalProperties": { "type": "string", "enum": ["path", "query", "body"] },
                "description": "Where each argument goes. Args named by a {placeholder} in path are auto 'path'. Unlisted args default to query (GET/DELETE) or body (POST/PUT)."
              },
              "responseKeys": { "type": "array", "items": { "type": "string" } }
            }
          }
        },
        "responseKeys": { "type": "array", "items": { "type": "string" }, "description": "Default response key allow-list (an operation may override it)." },
        "apiKeyUrl": { "type": "string", "format": "uri", "pattern": "^https://" },
        "authMode": {
          "type": "string",
          "enum": ["none", "oauth"],
          "description": "'none' (default) = static/keychain header secrets. 'oauth' = OAuth 2.1 browser sign-in; Cairn auto-refreshes tokens and injects Authorization: Bearer per request."
        },
        "oauth": {
          "type": "object",
          "additionalProperties": false,
          "description": "OAuth parameters for authMode:'oauth'. Omit serverUrl to run discovery + dynamic client registration against the apiUrl/baseUrl origin (works for any modern DCR-capable authorization server).",
          "properties": {
            "serverUrl": { "type": "string", "format": "uri", "pattern": "^https://", "description": "Authorization-server discovery base (defaults to the apiUrl/baseUrl origin)." },
            "scope": { "type": "string", "description": "Requested OAuth scope (space-delimited)." },
            "clientId": { "type": "string", "description": "Preregistered client id for vendors without DCR (Phase C)." },
            "authorizationUrl": { "type": "string", "format": "uri", "pattern": "^https://" },
            "tokenUrl": { "type": "string", "format": "uri", "pattern": "^https://" }
          }
        },
        "enabled": { "type": "boolean" }
      }
    }
  }
}
