{
  "kind": "service",
  "author": "cairn",
  "version": "1.1.0",
  "tags": [
    "search",
    "web"
  ],
  "blurb": "Web search results via the Brave Search API. Requires a free API key.",
  "category": "Search & Web",
  "brandColor": "#fb542b",
  "homepage": "https://brave.com/search/api",
  "icon": {
    "slug": "brave"
  },
  "definition": {
    "name": "Brave Search",
    "description": "Web search via Brave Search API.",
    "baseUrl": "https://api.search.brave.com",
    "headers": {
      "Accept": "application/json",
      "X-Subscription-Token": "<API_KEY>"
    },
    "operations": [
      {
        "name": "brave_web_search",
        "description": "Search the web with Brave Search.",
        "method": "GET",
        "path": "/res/v1/web/search",
        "toolDefinition": "{\"name\":\"brave_web_search\",\"description\":\"Search the web with Brave Search.\",\"parameters\":{\"type\":\"object\",\"properties\":{\"q\":{\"type\":\"string\",\"description\":\"Search query\"},\"count\":{\"type\":\"number\",\"description\":\"Number of results (max 20)\",\"default\":10}},\"required\":[\"q\"]}}",
        "responseKeys": [
          "web",
          "results",
          "title",
          "url",
          "description"
        ]
      }
    ],
    "apiKeyUrl": "https://brave.com/search/api",
    "enabled": true
  }
}
